Retailer,Category,Return Window (Days),Extended Window (Days),Extended For,Requires Receipt,Requires Original Buyer,Accepted Conditions,Restocking Fee,Accepts Third Party,Notes
Adidas,athletic_apparel,30,,,Yes,No,new; unworn; tags_attached,0,No,
Amazon,online_marketplace,30,,,No,No,new; used; good; acceptable,0,Yes,Most items returnable within 30 days. Third-party sellers may vary
Apple,electronics,14,,,Yes,No,new; unopened,0,No,Must be direct Apple purchase; not third-party retailer
Authorized Appliance,general_merchandise,14,,,Yes,Yes,factory_sealed_only,0,No,Appliances must be in original packaging; unopened.
Barnes & Noble,books,30,,,Yes,No,new; unopened,0,No,
Best Buy,electronics,15,,,Yes,No,new; unopened,15,No,Restocking fee waived for Elite members
Blush Boutique (Kirkwood),fashion,30,,,Yes,No,unworn; unwashed; tags_attached; smoke_free,0,No,Store credit only (no refunds). Extended holiday returns. Store credit never expires. Bohemian coastal fashion.
Catholic Supply of St. Louis,general_merchandise,30,,,Yes,No,unopened; tags_intact,0,No,Apparel: must return within 7 days; special orders final sale.
Cato Fashions (Arnold),fashion,30,,,Yes,No,unworn; tags_attached; new_condition,0,No,30 days with receipt for refund. After 30 days or without receipt: exchange/store credit at current price. Jefferson County - Arnold location (3926 Vogel Rd).
Cha Boutique (Ladue),fashion,21,,,Yes,No,unworn; tags_attached,0,No,Online purchases: 21-day return window. Store credit only. Sale items 30%+ off: final sale (no returns). 9666 Clayton Rd; Ladue. (314) 993-8080.
Clayton Claire Boutique,fashion,7,,,Yes,No,unworn; tags_attached,0,No,Store credit only (7 days). Tags must be attached; unworn. Damaged items: refund available if returned. West County - Clayton location.
Costco,warehouse_club,999999,,,No,No,new; used; opened,0,No,Unlimited returns on most items! Electronics have 90-day limit
DNA Boutique,fashion,30,,,Yes,No,unworn; new_condition,0,No,Premium streetwear. Store credit only (no cash refunds). 3-5 day processing. 1311 Washington Ave.
Designer Resale Boutique (St. Peters),fashion,7,,,Yes,No,unworn; tags_attached,0,No,Consignment/resale boutique established 1987. Family-owned. Store credit only. St. Charles County. Hours: Mon-Fri 10-6; Sat 10-5; Sun 12-4.
Dierbergs Markets,general_merchandise,30,,,Yes,No,unopened; perishable_within_7_days,0,No,Must return to same location of purchase.
East • West (St. Louis),fashion,7,,,Yes,No,tags_attached,0,No,Returns initiated within 7 days of delivery. All tags must be attached. Men's and women's fashion. Central West End boutique.
Gap,apparel,45,,,No,No,new; tags_attached; unworn,0,No,Applies to Gap; Old Navy; Banana Republic
Golden Gems,accessories,30,,,Yes,No,unused; undamaged; unopened,0,No,Full refund minus original shipping. Customer pays return shipping. After 30 days: store credit only. City Foundry location: 3108 Locust St.
H&M,fashion,30,,,Yes,No,new; tags_attached; unworn,0,No,
Home Depot,home_improvement,90,365,Online purchases,No,No,new; unopened,0,Yes,
IKEA,furniture,365,,,Yes,No,new; unopened; assembled,0,No,IKEA Family members get extended return window
JCPenney,department_store,90,,,No,No,new; tags_attached,0,Yes,
Kohl's,department_store,180,,,No,No,new; tags_attached,0,Yes,Also accepts Amazon returns
L.L.Bean,outdoor_apparel,365,,,No,No,new; used; worn,0,No,Legendary 100% satisfaction guarantee
Levine Hat Company,accessories,30,,,Yes,No,unworn; tags_attached,0,No,100+ year tradition. Regular items: refund or exchange. Sale/special orders: store credit only. Customer pays return shipping. 1416 Washington Ave.
Lowe's,home_improvement,90,,,No,No,new; unopened,0,Yes,
MOD Boutique,fashion,30,,,Yes,No,unworn; unwashed; tags_attached,0,No,Store credit only (e-gift card). Extended holiday returns. Prepaid return label available (cost deducted from credit). Multiple St. Louis locations: Ladue; Kirkwood; St. Charles; O'Fallon; Ellisville.
Macy's,department_store,30,90,Star Rewards members,No,No,new; tags_attached,0,Yes,
Marta's Boutique,fashion,7,,,Yes,No,unworn; tags_attached; no_alterations,0,No,Full refund within 7 days. Original tags required. Sister brand to MOD. Locations: Ellisville (9208 Clayton Rd).
Micro Center,electronics,15,30,Complete computer systems,Yes,No,new; unopened,15,No,
Nike,athletic_apparel,60,,,No,No,new; worn; gently_used,0,No,Nike members can return worn shoes within 60 days
Nordstrom,department_store,999999,,,No,No,new; gently_used; tags_attached,0,Yes,No time limit on returns! Legendary return policy
Paperdolls Boutique,fashion,15,,,Yes,No,unworn; tags_attached,0,No,Store credit or exchange only (no cash refunds). Store credit never expires. Multiple St. Louis locations.
REI,outdoor_gear,365,,,No,No,new; used; worn,0,No,Members can return used gear within 1 year
Randall's (ShopRandalls.com),general_merchandise,30,,,Yes,No,unopened,0,No,Must have original packaging and receipt for returns.
Sam's Club,warehouse_club,90,,,No,Yes,new; unopened,0,No,Must be a member to make returns
Schnucks,general_merchandise,30,,,No,No,unopened; fresh_products_refunded_immediately,0,No,Pharmacy returns not allowed by law.
Sephora,beauty,60,,,No,No,new; gently_used; opened,0,No,Beauty Insider members can return gently used products
St. Louis Zoo Gift Shop,general_merchandise,14,,,Yes,No,new_condition,0,No,Refund or exchange within 14 days with receipt.
State Beauty Supply,general_merchandise,60,,,Yes,Yes,new/unused_or_resellable,15,No,Appliances: 30 days unopened; 7 days opened; special handling for items > $100.
Target,general_merchandise,90,365,Target-owned brands,No,No,new; unopened; tags_attached,0,Yes,RedCard holders get extra 30 days on most items
The Vault Luxury Resale,general_merchandise,7,,,Yes,Yes,unworn; tags_attached,0,No,No returns on final sale or clearance items.
Two Pink Elephants,fashion,30,,,Yes,No,unworn; tags_attached,0,No,Store credit only (email code). Exchanges available for different sizes. Must email 2peboutique@gmail.com before returning. O'Fallon location: 4255 Keaton Crossing Blvd.
Ulta,beauty,60,,,No,No,new; gently_used; opened,0,No,
Urban Matter,home_decor,14,,,Yes,No,unused; undamaged,0,No,Local women-owned boutique featuring independent designers. Contact store for return policy details: (314) 924-0535. Location: 3179 S. Grand Blvd.
Walmart,general_merchandise,90,,,No,No,new; unopened,0,No,Does not accept third-party returns
Wayfair,furniture_online,30,,,No,No,new; unopened,0,No,Large furniture items may require scheduled pickup
World Wide Technology Raceway,general_merchandise,30,,,Yes,Yes,no_returns_allowed,0,No,All ticket sales final; no refunds on events unless canceled.
Zara,fashion,30,,,Yes,No,new; tags_attached; unworn,0,No,